{
  "schema_version": 1,
  "coordinate_space": "normalized_source_frame",
  "annotation_density": "synthetic",
  "source": {"name": "synthetic-contract-only", "frameCount": 5, "width": 100, "height": 100},
  "frames": [
    {
      "source_frame_index": 0,
      "visible_anatomical_side": "right",
      "landmarks": {
        "visible_shoulder": {"x": 0.5, "y": 0.2},
        "visible_hip": {"x": 0.5, "y": 0.4},
        "visible_knee": {"x": 0.55, "y": 0.62},
        "visible_ankle": {"x": 0.6, "y": 0.85}
      }
    },
    {
      "source_frame_index": 1,
      "visible_anatomical_side": "right",
      "landmarks": {
        "visible_shoulder": {"x": 0.5, "y": 0.22},
        "visible_hip": {"x": 0.5, "y": 0.44},
        "visible_knee": {"x": 0.55, "y": 0.66},
        "visible_ankle": {"x": 0.6, "y": 0.89}
      }
    },
    {
      "source_frame_index": 2,
      "visible_anatomical_side": "right",
      "phase": "bottom_transition",
      "landmarks": {
        "visible_shoulder": {"x": 0.5, "y": 0.24},
        "visible_hip": {"x": 0.5, "y": 0.48},
        "visible_knee": {"x": 0.55, "y": 0.7},
        "visible_ankle": {"x": 0.6, "y": 0.93}
      }
    },
    {
      "source_frame_index": 3,
      "visible_anatomical_side": "right",
      "landmarks": {
        "visible_shoulder": {"x": 0.5, "y": 0.22},
        "visible_hip": {"x": 0.5, "y": 0.44},
        "visible_knee": {"x": 0.55, "y": 0.66},
        "visible_ankle": {"x": 0.6, "y": 0.89}
      }
    },
    {
      "source_frame_index": 4,
      "visible_anatomical_side": "right",
      "landmarks": {
        "visible_shoulder": {"x": 0.5, "y": 0.2},
        "visible_hip": {"x": 0.5, "y": 0.4},
        "visible_knee": {"x": 0.55, "y": 0.62},
        "visible_ankle": {"x": 0.6, "y": 0.85}
      }
    }
  ]
}
